{
  "case_id": "A01",
  "candidate_id": "fixed-rule-demo-v0.3",
  "candidate_type": "deterministic_reference_pipeline",
  "is_real_model_output": false,
  "facts": [
    { "fact_id": "F-A01-WBC-CURRENT", "code": "WBC", "value": 1.8, "unit": "10^9/L", "source_ids": ["S-A01-LAB-002"] },
    { "fact_id": "F-A01-ANC-CURRENT", "code": "ANC", "value": 0.8, "unit": "10^9/L", "source_ids": ["S-A01-LAB-002"] },
    { "fact_id": "F-A01-HGB-CURRENT", "code": "HGB", "value": 108, "unit": "g/L", "source_ids": ["S-A01-LAB-002"] },
    { "fact_id": "F-A01-PLT-CURRENT", "code": "PLT", "value": 92, "unit": "10^9/L", "source_ids": ["S-A01-LAB-002"] }
  ],
  "changes": [
    { "change_id": "C-A01-WBC-DOWN", "code": "WBC", "direction": "down", "from": 3.2, "to": 1.8, "source_ids": ["S-A01-LAB-001", "S-A01-LAB-002"] },
    { "change_id": "C-A01-ANC-DOWN", "code": "ANC", "direction": "down", "from": 1.5, "to": 0.8, "source_ids": ["S-A01-LAB-001", "S-A01-LAB-002"] },
    { "change_id": "C-A01-PLT-DOWN", "code": "PLT", "direction": "down", "from": 136, "to": 92, "source_ids": ["S-A01-LAB-001", "S-A01-LAB-002"] }
  ],
  "missing_information": [
    { "missing_id": "M-A01-VITALS", "label": "当前生命体征" },
    { "missing_id": "M-A01-SYMPTOMS", "label": "当前症状与床旁评估" },
    { "missing_id": "M-A01-CURRENT-PLAN", "label": "当前已执行或拟定处理" }
  ],
  "tasks": [
    { "task_id": "T-A01-BEDSIDE", "objective": "verify_current_vitals_and_symptoms", "status": "pending_human_confirmation" },
    { "task_id": "T-A01-SOURCE", "objective": "verify_report_values_and_source", "status": "pending_human_confirmation" },
    { "task_id": "T-A01-ESCALATE", "objective": "request_supervisor_review_before_action", "status": "pending_human_confirmation" }
  ],
  "safety": {
    "auto_diagnosis": false,
    "specific_treatment": false,
    "mark_action_completed": false,
    "human_review_required": true
  }
}
